{
  "project_warning_id": "project_warning_luna_fit_001",
  "content_opportunity_id": "content_opportunity_luna_fit_001",
  "warning_type": "urgency_window_expired",
  "severity": "important",
  "message": "The two-week lunch-reset window closes on 2026-07-17 and the project is still in planning.",
  "detected_on": "2026-07-15T08:00:00",
  "suggested_actions": [
    "Pull the project forward, or re-score urgency before the window closes."
  ],
  "project_id": "project_luna_tiny_reset_001",
  "concept_approval_id": "concept_approval_luna_fit_001",
  "source_evidence_ids": [
    "evidence_luna_fit_001"
  ],
  "resolved_status": "open"
}
